{
  "schemaVersion": "v1",
  "bootstrapId": "vitalserver-guest-product-bootstrap",
  "volumeLabel": "CIDATA",
  "guestBootstrapVolumeFileSystem": "iso9660",
  "instanceId": "vitalserver-guest-bootstrap-instance",
  "localHostName": "vitalserver-guest",
  "guestArchitecture": "arm64",
  "guestProductRelease": {
    "releaseId": "vitalserver-guest-product-0.2.0-dev",
    "releaseDirectory": "/opt/vitalserver/releases/vitalserver-guest-product-0.2.0-dev",
    "currentReleaseLinkPath": "/opt/vitalserver/current",
    "releaseStateDirectory": "/var/lib/vitalserver/guest-product-releases",
    "releaseStateDirectoryMode": "0700"
  },
  "guestRuntime": {
    "artifactId": "guest-runtime-linux-arm64",
    "destinationPath": "/opt/vitalserver/releases/vitalserver-guest-product-0.2.0-dev/bin/guest-runtime",
    "fileMode": "0755"
  },
  "guestRuntimeStateDirectory": {
    "directoryPath": "/var/lib/vitalserver/guest-runtime",
    "directoryMode": "0700"
  },
  "guestTimeSynchronization": {
    "packageManager": "apt",
    "packageName": "chrony",
    "serviceName": "chrony.service",
    "configurationDestinationPath": "/etc/chrony/chrony.conf"
  },
  "guestTelemetryCollector": {
    "artifactId": "guest-telemetry-collector-linux-arm64",
    "destinationPath": "/opt/vitalserver/releases/vitalserver-guest-product-0.2.0-dev/bin/guest-telemetry-collector",
    "fileMode": "0755"
  },
  "guestTelemetryCollectorConfiguration": {
    "artifactId": "guest-telemetry-collector-configuration",
    "destinationPath": "/opt/vitalserver/releases/vitalserver-guest-product-0.2.0-dev/config/guest-telemetry-collector.yaml",
    "fileMode": "0644"
  },
  "guestTelemetryStateDirectory": {
    "directoryPath": "/var/lib/vitalserver/telemetry",
    "directoryMode": "0700"
  },
  "guestNodeServicesBundle": {
    "artifactId": "guest-node-services-linux-arm64",
    "archiveFormat": "tar-gzip",
    "entryModePolicy": "preserve-archive-mode",
    "symbolicLinkPolicy": "allow-relative-links-to-declared-regular-files",
    "destinationDirectory": "/opt/vitalserver/releases/vitalserver-guest-product-0.2.0-dev",
    "requiredArchivePaths": [
      "node/bin/node",
      "recorder-gateway/dist/cmd/recorder-gateway.js",
      "lab-recorder-runner/dist/cmd/lab-recorder-runner.js",
      "lab-recorder-runner/lab-scenario-catalog.json"
    ]
  },
  "guestProductProcessSupervisor": {
    "artifactId": "guest-product-process-supervisor-linux-arm64",
    "destinationPath": "/opt/vitalserver/releases/vitalserver-guest-product-0.2.0-dev/bin/guest-product-process-supervisor",
    "fileMode": "0755"
  },
  "guestProductProcessDeployment": {
    "artifactId": "guest-product-process-deployment-configuration",
    "destinationPath": "/opt/vitalserver/releases/vitalserver-guest-product-0.2.0-dev/config/guest-product-process-deployment.json",
    "fileMode": "0644"
  },
  "guestProductReleaseManager": {
    "executable": {
      "artifactId": "guest-product-release-manager-linux-arm64",
      "destinationPath": "/opt/vitalserver/releases/vitalserver-guest-product-0.2.0-dev/bin/guest-product-release-manager",
      "fileMode": "0755"
    },
    "configuration": {
      "artifactId": "guest-product-release-manager-configuration",
      "destinationPath": "/opt/vitalserver/releases/vitalserver-guest-product-0.2.0-dev/config/guest-product-release-manager.json",
      "fileMode": "0644"
    },
    "serviceUnit": {
      "serviceUnitName": "vitalserver-guest-product-release-manager.service",
      "unitDestinationPath": "/etc/systemd/system/vitalserver-guest-product-release-manager.service",
      "enabledUnitLinkPath": "/etc/systemd/system/multi-user.target.wants/vitalserver-guest-product-release-manager.service",
      "enabledUnitLinkTargetPath": "/etc/systemd/system/vitalserver-guest-product-release-manager.service",
      "restart": { "mode": "on-failure", "delayMilliseconds": 1000 },
      "logging": { "standardOutput": "journal+console", "standardError": "journal+console" },
      "install": { "wantedByTarget": "multi-user.target" }
    }
  },
  "guestProductVitalServerTopologyDeployment": {
    "artifactId": "guest-product-vitalserver-topology-deployment",
    "destinationPath": "/opt/vitalserver/releases/vitalserver-guest-product-0.2.0-dev/config/guest-product-vitalserver-topology-deployment.json",
    "fileMode": "0644"
  },
  "guestBundledUpstreamImageSetManager": {
    "managerId": "bundled-upstream-image-set-manager",
    "executable": {
      "artifactId": "guest-bundled-upstream-image-set-manager-linux-arm64",
      "destinationPath": "/opt/vitalserver/releases/vitalserver-guest-product-0.2.0-dev/bin/guest-bundled-upstream-image-set-manager",
      "fileMode": "0755"
    },
    "configuration": {
      "artifactId": "guest-bundled-upstream-image-set-manager-configuration",
      "destinationPath": "/opt/vitalserver/releases/vitalserver-guest-product-0.2.0-dev/config/guest-bundled-upstream-image-set-manager-configuration.json",
      "fileMode": "0644"
    },
    "stateDirectory": {
      "directoryPath": "/var/lib/vitalserver/bundled-upstream-image-sets",
      "directoryMode": "0700"
    },
    "containerEngineBootstrap": {
      "packageManager": "apt",
      "packageName": "docker.io",
      "serviceName": "docker.service"
    },
    "serviceUnit": {
      "serviceUnitName": "vitalserver-guest-bundled-upstream-image-set-manager.service",
      "unitDestinationPath": "/etc/systemd/system/vitalserver-guest-bundled-upstream-image-set-manager.service",
      "enabledUnitLinkPath": "/etc/systemd/system/multi-user.target.wants/vitalserver-guest-bundled-upstream-image-set-manager.service",
      "enabledUnitLinkTargetPath": "/etc/systemd/system/vitalserver-guest-bundled-upstream-image-set-manager.service",
      "restart": { "mode": "on-failure", "delayMilliseconds": 1000 },
      "logging": { "standardOutput": "journal+console", "standardError": "journal+console" },
      "install": { "wantedByTarget": "multi-user.target" }
    },
    "initialActiveImageSetState": "unprovisioned"
  },
  "guestProductServiceManagerDeployment": {
    "artifactId": "guest-product-service-manager-deployment-configuration",
    "configurationDestinationPath": "/opt/vitalserver/releases/vitalserver-guest-product-0.2.0-dev/config/guest-product-service-manager-deployment.json",
    "unitDestinationPath": "/etc/systemd/system/vitalserver-guest-product.service",
    "enabledUnitLinkPath": "/etc/systemd/system/multi-user.target.wants/vitalserver-guest-product.service",
    "enabledUnitLinkTargetPath": "/etc/systemd/system/vitalserver-guest-product.service"
  }
}
